user_input,retrieved_contexts,response,reference,faithfulness,answer_relevancy,context_precision,context_recall
How does Data Visualization contribute to Business Intelligence?,"['Les outils de BI permettent ensuite de choisir des jeux de données et de créer des interactions et des relations entre eux.', ""Il est possible de combiner les données avec un langage de présentation plus intuitif et plus simple, afin de faciliter la compréhension. L'utilisateur peut ainsi directement visualiser les données qui lui sont"", ""Les outils de Business Intelligence permettent d'accéder à ces données en temps réel et de les transformer grâce à des applications Web."", ""Une fois que ces données sont sélectionnées par le créateur du rapport, elles sont modélisées sous forme de visuels (tableaux de bords, graphiques, etc.). C'est ce qu'on appelle la Data Visualisation."", ""Elle permet de prendre des décisions et de suivre des tendances, grâce à des outils d'analyse dynamiques.\nElle offre de nouveaux moyens de gérer la performance au quotidien et d'être en mesure de réagir rapidement grâce à des tableaux de bord précis et synthétiques\nDans les entreprises, la Business Intelligence apporte un gain de temps et de fiabilité à ses utilisateurs. La finalité ultime étant\n2 - POURQUOI FAIRE DE LA BUSINESS INTELLIGENCE ? 2-1 - Les avantages de la BI dans les métiers de gestion et de la finance\nUn gain de temps considérable dans la construction et la mise à jour des reportings et des analyses ;\nDes données plus fiables, lorsque les processus de nettoyage et modélisation sont bien en place ; de\nLibérer du temps aux utilisateurs pour la stratégie, l'amélioration continue, et la gestion des risques ;""]","La Data Visualization contribue à la Business Intelligence en facilitant la compréhension des données grâce à des représentations visuelles, telles que des tableaux de bord, des graphiques, etc., ce qui permet d'identifier des tendances et de prendre des décisions éclairées.",Data Visualization is a crucial component of Business Intelligence as it enables users to quickly visualize important information and make it accessible for analysis.,0.75,0.971886502202461,0.0,0.3333333333333333
How can big data be used for commercial purposes?,"[""Les outils de Business Intelligence permettent d'accéder à ces données en temps réel et de les transformer grâce à des applications Web."", ""Il est possible de combiner les données avec un langage de présentation plus intuitif et plus simple, afin de faciliter la compréhension. L'utilisateur peut ainsi directement visualiser les données qui lui sont"", 'Les outils de BI permettent ensuite de choisir des jeux de données et de créer des interactions et des relations entre eux.', 'Dans les entreprises, dirigeants, managers et opérationnels peuvent désormais disposer de la bonne information, au bon format et au bon', ""La Business Intelligence s'appuie sur le processus ETL (Extract Transform Load) pour offrir à l'utilisateur la donnée la plus pertinente.""]","Les outils de Business Intelligence permettent d'utiliser les données massives pour des fins commerciales en accédant aux informations en temps réel, en transformant les données grâce à des applications Web, en combinant les données avec des langages de présentation plus intuitifs, en créant des interactions et des relations entre les jeux de données, et en utilisant le processus ETL pour offrir des données pertinentes.",Big data can be used commercially by treating and analyzing large quantities of data from various sources to gain insights useful for business operations.,0.8333333333333334,0.7570138211426989,0.0,1.0
How can bar graphs aid in decision-making based on discrete data?,"[""Il est possible de combiner les données avec un langage de présentation plus intuitif et plus simple, afin de faciliter la compréhension. L'utilisateur peut ainsi directement visualiser les données qui lui sont"", ""- • Facilité d'interprétation : Les barres représentent clairement les catégories et leurs fréquences, ce qui facilite l'interprétation des données.\n- • Comparaisons visuelles : de la fréquence ou la distribution des catégories, utile pour les analyses comparatives.\n- • Personnalisation : pour rendre les graphiques informatifs et esthétiques.\n- • Adaptabilité : fonctionnent pour des variables catégoriques avec un petit nombre de catégories, mais aussi pour des variables avec un nombre plus élevé de catégories.\n- • Prise de décision : Utilisés pour prendre des décisions basées sur des données discrètes."", ""Les barres sont utiles pour représenter des variables discrètes (catégoriques) et facilitent l'interprétation des données, les comparaisons visuelles, la personnalisation et la prise de décision."", ""- • Explorer la distribution des variables individuelles dans un ensemble de données en utilisant des visualisations univariées.\n- • Cela permettra d'identifier les caractéristiques clés et les anomalies dans les données.\n- • La personnalisation des graphiques est importante pour les rendre compréhensibles et informatifs.\n- • Il faut choisir les visualisations appropriées en fonction du type de variable (continue ou catégorique) et des objectifs de leur analyse.\n- • On peut créer des histogrammes pour visualiser la distribution des variables"", ""2) La consolidation\nLes données prennent forme dans des rapports composés de cartes, de graphiques, de tableaux et de différents visuels. Le système d'information devient décisionnel. La datavisualisation et le datastorytelling interviennent, pour tirer parti des données extraites.""]","La barre graphique aide à la prise de décision basée sur des données discrètes en facilitant l'interprétation des données, les comparaisons visuelles, la personnalisation et l'adaptabilité.","Bar graphs can aid in decision-making based on discrete data by facilitating clear interpretations of category frequencies, enabling visual comparisons between distributions, and allowing for customization to make the graphs informative and aesthetically pleasing.",1.0,0.7523551055492176,0.5833333333041666,1.0
How does Hadoop's HDFS component contribute to the framework's ability to handle large-scale data processing and ensure fault tolerance?,"[""- = Composants de base: HDFS — MapReduce /Yarn\n- = D'autres outils existant pour:\n- = La simplification des opérations de traitement sur les données\n- = La gestion et coordination de la plateforme\n- =» Le monitoring du cluster"", ""- Nous utiliserons Hadoop avec un seul noeud pour tester et utiliser quelques commandes HDFS.\n- Les clients HDFS utilisent la propriete fs.default.name ou fs.defaultFS de Hadoop pour determiner I'URL de I'hote et le port du NameNode HDFS.\n- Nous Iutiliserons sur localhost (fs.defaultFS = hdfs:/ocalhost: 8020) avec le port HDFS par defaut, 8020.\n- Les proprietes et parametres Hadoop sont dans des fichiers de configuration:\n[TABLE]\n/etc/hadoop/conf/core-site.xml /etc/hadoop/conf/hdfs-site.xml: facteur de réplication (dfs.replication) NameNode secondaire (dfs.namenode.secondary.http-address),"", ""- HDFS : Systeme de fichiers concu pour stocker des fichiers tres volumineux dans un cluster d'ordinateurs pas chers.\n- HDFS stocke les donnees sur plusieurs noeuds (cluster)\n- ll existe des clusters Hadoop qui stockent des Po de donnees.\n- Ecrire une fois/lire plusieurs fois (WORM: write once read many times): LES donnees sont generalement generees ou copiees a partir de la source. Des analyses (batch) sont ensuite effectuees sur cet ensemble de donnees au fil du temps. Chaque analyse impliquera une grande proportion, sinon la totalite, de l'ensemble de donnees.\n- HDFS replique les donnees sur plusieurs noeuds afin d'eviter leur perte en cas de panne de certains noeuds > Fiabilite, Disponibilite\n- Chaque fichier est decompose en plusieurs blocs qui seront repliques sur les noeuds."", '- Les avantages apportés aux entreprises par Hadoop sont nombreux. Grâce à ce framework, il est possible de stocker et de traiter de vastes quantités de données rapidement. Face à l’augmentation en hausse du volume de données et à leur diversification, principalement liée aux réseaux sociaux et à l’internet des objets,il s’agit d’un avantage non négligeable.\n- le modèle de calcul distribué d’Hadoop permet de traiter rapidement le Big Data. Plus le nombre de nœuds de calcul utilisés est important, plus la puissance de traitement est élevée. Les données et les applications traitées sont protégées contre les échecs hardware. Si un nœud tombe en panne, les tâches sont directement redirigées vers d’autres nœuds pour s’assurer que le calcul distribué n’échoue pas.De multiples copies de toutes les données sont stockées automatiquement.', '- Hadoop est un framework logiciel open source permettant de stocker des données, et de lancer ds applications sur des grappes de machines standards. Cette solution offre un espace de stockage massif pour tous les types de données, une immense puissance de traitement et la possibilité de prendre en charge une quantité de tâches virtuellement illimitée. Basé sur Java, ce framework fait partie du projet Apache, sponsorisé par Apache Software Foundation.']","L'HDFS contribue à la capacité de Hadoop à gérer les grandes échelles de traitement de données et à garantir la tolérance aux pannes en décomposant les fichiers en plusieurs blocs qui sont répliqués sur plusieurs nœuds, permettant ainsi de stocker des données volumineuses dans un cluster d'ordinateurs peu coûteux et d'éviter leur perte en cas de panne de certains nœuds.","Hadoop's HDFS (Hadoop Distributed File System) component contributes to its ability to handle large-scale data processing by storing multiple copies of all data across different nodes in a cluster. This redundancy ensures fault tolerance, as if one node fails, the tasks can be redirected to other nodes, preventing the distributed calculation from failing.",0.8,0.867934677436692,0.4166666666458333,1.0
How has the explosion of data led to the necessity for Big Data solutions in various industries like e-commerce and online advertising?,"['- L’explosion quantitative des données numériques a obligé les chercheurs à trouver de nouvelles manières de voir et d’analyser le monde des données.\n- Il s’agit de découvrir de nouveaux ordres de grandeur pour capture, recherche, partage, stockage, analyse et présentation des données.\n- le BD est partout, et utile pour l’entreprise : e-commerce, publicité, comportement de navigation sur Internet… Il s’agit d’un concept permettant de stocker un nombre indicible d’informations sur une base numérique.', ""Une solution Big Data doit apporter une valeur ajoutée pour l'entreprise en répondant à des objectifs commerciaux ou Marketing."", ""Le Big Data est un ensemble d'informations et de données très diverses. Il intègre des données"", ""- «ll n'y a pas de definition unique du Big Data, mais certains elements sont communs a toutes les définitions: la velocite, le volume, la variéte.\n- * Extraire, de maniere rapide et rentable, des connaissances a partir de donnees volumineuses , variées et d'une vitesse élevéee.\n[TABLE]\nVolume: varie de terabytes a4 zettabytes. On doit traiter i“ ~ efficacement ce volume croissant. Variete: Gérer divers types et structures de données Velocite: Analyser les flux de données en continu et les grands volumes de données persistantes. a) Veracite: authenticité et fiabilité des données necessitant une grande rigueur dans la _ collecte, le recoupement, le croisement et l'enrichissement des données pour lever l'incertitude pour garantir 'integrite des données.\nValeur: le point le plus important, une solution Big Data doit apporter une valeur ajoutee pour l'entreprise en repondant a des objectifs commerciaux ou Marketing qui orientent l'utilisation des Big Data."", ""- La notion de Big Data est un concept s'étant popularisé en 2012 pour traduire le fait que les entreprises sont confrontées à des volumes de données à traiter de plus en plus considérables et présentant un fort enjeux commercial et marketing\n- Ces Grosses Données en deviennent difficiles à travailler avec des outils classiques de gestion de base de données\n- Il s’agit donc d’un ensemble de technologies, d’architecture, d’outils et de procédures permettant à une organisation de très rapidement collecter, traiter et analyser de larges quantités et contenus hétérogènes et changeants et d’en extraire les informations pertinentes à un coût accessible.""]","L'explosion des données a conduit à la nécessité de solutions Big Data dans diverses industries comme l'e-commerce et la publicité en ligne car elle oblige les chercheurs à trouver de nouvelles façons de voir et d'analyser le monde des données, nécessitant de nouveaux ordres de grandeur pour capturer, rechercher, partager, stocker, analyser et présenter les données.","The explosion quantitative des données numériques has led to the need for new ways to capture, analyze, and present large datasets. This has resulted in the development of Big Data solutions, which are useful across various industries such as e-commerce and online advertising.",1.0,0.893143455128985,0.699999999965,0.5
What is the method to handle missing data using mode?,"[""Il est possible de combiner les données avec un langage de présentation plus intuitif et plus simple, afin de faciliter la compréhension. L'utilisateur peut ainsi directement visualiser les données qui lui sont"", ""La Business Intelligence s'appuie sur le processus ETL (Extract Transform Load) pour offrir à l'utilisateur la donnée la plus pertinente."", ""Le processus ETL (Extract Transform Load) permet d'agréger un grand volume de données et de les transformer, afin d'en extraire des informations pertinentes pour l'utilisateur."", ""Les outils de Business Intelligence permettent d'accéder à ces données en temps réel et de les transformer grâce à des applications Web."", ""Une fois que ces données sont sélectionnées par le créateur du rapport, elles sont modélisées sous forme de visuels (tableaux de bords, graphiques, etc.). C'est ce qu'on appelle la Data Visualisation.""]",La méthode pour gérer les données manquantes en utilisant la mode consiste à utiliser la valeur la plus fréquente dans la série de données.,The method to handle missing data using mode involves imputing the values with the most frequent value in that column or row.,0.0,0.974917227956876,0.0,0.0
Can you explain how the proces ETL is used in Business Intelligence?,"[""Le processus ETL (Extract Transform Load) permet d'agréger un grand volume de données et de les transformer, afin d'en extraire des informations pertinentes pour l'utilisateur."", ""La Business Intelligence s'appuie sur le processus ETL (Extract Transform Load) pour offrir à l'utilisateur la donnée la plus pertinente."", 'le processus ETL extrait les données de différentes sources internes et externes (SI opérationnel, Web, CRM, ERP, etc.).', 'Les outils de BI permettent ensuite de choisir des jeux de données et de créer des interactions et des relations entre eux.', ""Les outils de Business Intelligence permettent d'accéder à ces données en temps réel et de les transformer grâce à des applications Web.""]","Le processus ETL est utilisé dans la Business Intelligence pour extraire des données de différentes sources internes et externes, telles que SI opérationnel, Web, CRM, ERP, etc. Il transforme ensuite ces données pour fournir des informations pertinentes aux utilisateurs. Ensuite, les outils de BI permettent d'accéder à ces données en temps réel et de les transformer grâce à des applications Web.","The proces ETL is used in Business Intelligence by extracting data from various internal and external sources like operational systems, web, CRM, ERP, etc., transforming it to make it suitable for analysis, and loading it into a database. This process enables Business Intelligence to provide the most relevant data to users.",1.0,0.9470821743767712,0.0,0.6666666666666666
What are the top three business intelligence tools according to Gartner's Magic Quadrant?,"[""[TABLE]\nde Business Intelligence sont présentés par le Magic Cadrant de\nIl s'agit de Power BI, Tableau Software et QlikView."", ""Les outils de Business Intelligence permettent d'accéder à ces données en temps réel et de les transformer grâce à des applications Web."", ""1 - Définition : C'est quoi la Business Intelligence ? 1.1 - Business Intelligence et Business Analytics\n2 - Pourquoi faire de la Business Intelligence ? 3 - Quel est l'objectif de la Business Intelligence ? 4 - Comment fonctionne la BI ?\nPr OULAD SAYAD Younes"", 'Microsoft Power BI est le leader du marché. Il offre de nombreuses possibilités d\'utilisation entreprises, grâce à sa plateforme PowerApp et à l\'intégration avec des outils ""maisons"" de Microsoft : Excel et Power Query pour ne citer d\'eux. aux\nGoogle a également sa solution de BI : Google Data Studio. Data Studio, est un outil gratuit de Business Intelligence, utilisé dans le cloud. Moins puissant que Power BI ou Tableau Software, il est tout de même utilisé dans bon nombre d\'entreprises, ayant l\'habitude de travailler avec Google Workspace.', ""1 - Définition : C'est quoi la Business Intelligence ? 1.1 - Business Intelligence et Business Analytics\nLa BA apparaît en aval du processus de BI""]","Les trois principaux outils de Business Intelligence selon le Magic Quadrant de Gartner sont Power BI, Tableau Software et QlikView.","According to the context provided, the top three business intelligence tools presented by Gartner's Magic Quadrant are Power BI, Tableau Software, and QlikView.",1.0,0.9810284592839779,0.9999999999,1.0
How can Exploratory Data Analysis (EDA) help address the issue of missing data in a dataset and what strategies could be employed to handle these missing values?,"[""Il existe plusieurs stratégies pour gérer les valeurs manquantes, notamment la suppression des lignes, l'imputation, la conservation des valeurs manquantes, et le comptage du nombre de valeurs manquantes par colonne."", ""- • Les données manquantes peuvent entraîner des erreurs dans l'analyse et les modèles.\n- • On utilise les méthodes isna() ou isnull() pour identifier les données manquantes.\n- • Il existe différentes stratégies pour gérer les données manquantes :\n- • Supprimer les lignes ou les colonnes contenant des données manquantes.\n- • Imputer les valeurs manquantes par la moyenne, la médiane, le mode, ou d'autres méthodes pertinentes.\n- • La stratégie dépendra du contexte et de la quantité de données manquantes."", ""- • Comprendre l'importance de l’EDA (Exploratory Data Analysis) dans le processus d'analyse de données et de préparation pour l'apprentissage automatique.\n- • Apprendre à faire l'EDA et la préparation des données.\n- • Maîtriser les techniques de visualisation pour révéler des informations essentielles dans les données.\n- • Préparer les données de manière appropriée pour l'entraînement de modèles d'apprentissage automatique."", ""- • L'EDA aide à découvrir des tendances, des modèles et des informations importantes dans les données.\n- • Elle permet d'identifier les erreurs, les valeurs aberrantes, les données manquantes et de prendre des décisions éclairées sur la\n- • Elle favorise une meilleure compréhension des données, ce qui est essentiel pour choisir les bonnes techniques de prétraitement et les modèles d'apprentissage automatique appropriés."", '- • Les valeurs manquantes peuvent biaiser les analyses et les modèles si elles ne sont pas correctement traitées.\n- • Elles peuvent indiquer des problèmes de collecte de données ou des erreurs dans les données.\n- • Identifier les valeurs manquantes est la première étape pour décider comment les gérer.']","L'Exploratory Data Analysis (EDA) peut aider à identifier les données manquantes en utilisant les méthodes isna() ou isnull(). Pour gérer ces valeurs manquantes, on peut employer différentes stratégies : supprimer les lignes ou les colonnes contenant des données manquantes, imputer les valeurs manquantes par la moyenne, la médiane, le mode, ou d'autres méthodes pertinentes. La stratégie dépendra du contexte et de la quantité de données manquantes.","Exploratory Data Analysis (EDA) helps identify missing data in a dataset, allowing for informed decisions on how to handle them. Strategies to manage missing values include removing rows or columns with missing data, imputing missing values using methods like mean, median, mode, or other appropriate techniques, depending on the context and quantity of missing data.",1.0,0.8437411861652296,0.49999999995,0.6
"How do duplicates in data affect the calculation of descriptive statistics such as mean, median, standard deviation, minimum, maximum, and quartiles?","[""- • Calculer différentes statistiques descriptives:\n- • Moyenne (mean) : La somme des valeurs divisée par le nombre d'observations.\n- • Médiane (median) : La valeur du milieu lorsque les données sont triées.\n- • Écart type (standard deviation) : Mesure de la dispersion des données par rapport à la moyenne.\n- • Minimum et maximum : Les valeurs les plus basses et les plus élevées dans les données.\n- • Quartiles : Les valeurs qui divisent les données en quatre parties égales."", ""- • Utilisée pour comprendre les relations entre les variables.\n- • Étape cruciale dans l'analyse de données.\n- • La détection de corrélations ou de dépendances entre les variables.\n- • La capacité à identifier des tendances et des modèles complexes.\n- • L'aide à la prise de décision informée en identifiant les facteurs qui influencent les résultats.\n- • Outils de visualisation à utiliser :\n- • des graphiques de dispersion (scatter plots) pour les relations bivariées\n- • des heatmaps ainsi que des pairplots pour les relations multivariées."", ""- • Suppression des lignes : supprimer les lignes qui contiennent des valeurs manquantes si leur nombre est négligeable par rapport à la taille de l'ensemble de données.\n- • Imputation : remplacer les valeurs manquantes par des valeurs calculées, comme la moyenne, la médiane ou le mode pour les données numériques, ou une valeur catégorique pour les données catégoriques.\n- • Conservation des valeurs manquantes : Dans certains cas, il peut être approprié de conserver les valeurs manquantes pour des raisons spécifiques.\n- • Compter le nombre de valeurs manquantes par colonne est recommandé.\n- • Cela donne une vue d'ensemble rapide des colonnes qui ont des données manquantes."", ""- • Explorer la distribution des variables individuelles dans un ensemble de données en utilisant des visualisations univariées.\n- • Cela permettra d'identifier les caractéristiques clés et les anomalies dans les données.\n- • La personnalisation des graphiques est importante pour les rendre compréhensibles et informatifs.\n- • Il faut choisir les visualisations appropriées en fonction du type de variable (continue ou catégorique) et des objectifs de leur analyse.\n- • On peut créer des histogrammes pour visualiser la distribution des variables"", 'Les types de données déterminent les opérations que vous pouvez effectuer sur les colonnes, et influencent la manière dont vous pouvez traiter les données.']","Les doublons dans les données peuvent avoir un impact significatif sur les calculs des statistiques descriptives telles que la moyenne, la médiane, l'écart-type, le minimum, le maximum et les quartiles. 

Lorsque des doublons existent dans les données, ils peuvent entraîner :

* Une moyenne incorrecte, car elle sera influencée par la répétition de certaines valeurs.
* Une médiane incorrecte, car elle ne représente pas correctement la valeur centrale des données.
* Un écart-type incorrect, car il sera sous-estimé en raison de la concentration de valeurs similaires.
* Des minimum et maximum incorrects, car ils seront influencés par la présence de doublons.
* Des quartiles incorrects, car ils ne représentent pas correctement la division des données en quatre parties égales.

Il est donc essentiel de nettoyer les données et de traiter les doublons avant de procéder aux calculs des statistiques descriptives.","Duplicates in data can significantly impact the calculation of descriptive statistics. They can cause an overestimation of the sample size, influencing statistics like mean (calculated as the sum of values divided by the number of observations), median, standard deviation (a measure of data dispersion), minimum, maximum, and quartiles. Additionally, duplicates may introduce biases in machine learning models.",0.0,0.9500007869372332,0.0,0.0
What are the backend technologies mentioned in this context?,"['- ""a collection of data from traditional and digital sources inside and outside a company that represent a source of ongoing discovery and analysis.""\n- * Quelques exemples d\'utilisation de la Big Data\n- * Commercial\n- * Science\n- « Web / event / database logs\n- e Astronomy\n- * Sensor networks\n- « Atmospheric science\n- * Internet text and documents\n- * Genomics\n- * Medical records\n- * Biogeochemical\n- « Photographic archives\n- * Biological\n- * Video / audio archives\n- * Social\n- ¢ Social networks\n- * Government\n- « Military and homeland security surveillance\n- * Social data\n- * Twitter\n- * Facebook', 'Framework JavaScript (ou TypeScript)\n➢Présenté par Google en 2009\n- ➢Permettant de créer des applications web et mobiles :\n- ➢Front-End (l’ensemble des éléments visibles et accessibles directement sur une application web ou une application web mobile)\n- ➢Single page Application (Une SPA est une application qui contient une seule page HTML (index.html) récupérée du serveur).', ""La Business Intelligence est une solution informatique qui permet aux utilisateurs de visualiser et d'analyser des données en temps réel (données de gestion, de finance, d'activité commerciale, de marketing, etc.)."", ""Un ensemble de technologies, d'architecture, d'outils et de procédures permettant à une organisation de collecter, traiter et analyser de larges quantités et contenus hétérogènes et changeants, et d'en extraire les informations pertinentes à un coût accessible."", ""Les outils de Business Intelligence permettent d'accéder à ces données en temps réel et de les transformer grâce à des applications Web.""]","Les technologies back-end mentionnées sont : 
- Google Framework (JavaScript/TypeScript) 
- Outils de Business Intelligence","The backend technologies mentioned in this context are PHP, JEE, .Net, and Node JS.",0.3333333333333333,0.8984567973158336,0.0,0.25
How does the Secondary NameNode in Hadoop contribute to high availability and what are the steps involved in recovering a failed NameNode?,"[""- * Secondary NameNode (suite)\n- *La replication des metadonnees du NameNode et utilisation du NameNode secondaire permet d'eviter la perte de metadonneées et de conserver des copies recentes.\n- * Mais elle n'offre pas une haute disponibilite du systeme de fichiers: oEn cas d'echec du NameNode, tous les clients, y compris les jobs MapReduce, ne pourraient pas lire, ecrire ou repertorier les fichiers, car le NameNode est le seul referentiel des metadonnees et du mapping fichier-bloc.\n- oDans un tel cas, l'ensemble du systeme Hadoop serait hors service jusqu'a ce qu'un nouveau NameNode puisse etre mis en ligne.\n- *Pour recuperer un NameNode defaillant, l'administrateur demarre un nouveau NameNode avec l'une des copies de metadonnees du systeme de fichiers et configure les DataNodes et les applications pour utiliser ce nouveau NameNode."", '- ""Le NameNode est un point de deéfaillance unique (Single Point of Failure - SPOF): Si la machine executant le NameNode est perdue, toutes les informations (meta-data) sur les fichiers de données seraient perdues. Par conséquent, on ne pourra pas reconstruire les fichiers a partir des blocs sur les DataNodes.\n- ""Hadoop sauvegarde les métadonnees du systeme de fichiers (Fsilmage): NameNode écrit son etat persistant sur plusieurs systemes de fichiers (disque local, disque distant).\n- * Utiliser un NameNode secondaire: n\'a pas le meme role que le NameNode. Il fusionne periodiquement I\'image de l\'espaces des noms (Fslmage) et le journal d\'édition (EditLog) pour eviter que ce dernier devienne trop volumineux. Il s\'execute sur une machine physique distincte (nécessite beaucoup de CPU et de RAM pour effectuer la fusion', ""- Nous utiliserons Hadoop avec un seul noeud pour tester et utiliser quelques commandes HDFS.\n- Les clients HDFS utilisent la propriete fs.default.name ou fs.defaultFS de Hadoop pour determiner I'URL de I'hote et le port du NameNode HDFS.\n- Nous Iutiliserons sur localhost (fs.defaultFS = hdfs:/ocalhost: 8020) avec le port HDFS par defaut, 8020.\n- Les proprietes et parametres Hadoop sont dans des fichiers de configuration:\n[TABLE]\n/etc/hadoop/conf/core-site.xml /etc/hadoop/conf/hdfs-site.xml: facteur de réplication (dfs.replication) NameNode secondaire (dfs.namenode.secondary.http-address),"", ""- *Le nouveau NameNode ne peut repondre aux demandes des clients tant qu'il n'a pas (1) charge son Fslmage dans la memotre, (2) relu son journal d'edition (EditLog) , et (3) recu suffisamment de rapports de blocs des DataNodes pour quitter le mode sans echec (Safe Mode).\n- * Sur les grands clusters avec un grand nombre de fichiers et de blocs, le temps necessaire pour qu'un NameNode demarre a froid peut étre de 30 minutes ou plus.\n- *Le long temps de recuperation est egalement un probleme pour l'entretien de routine.\n- * Hadoop 2 a remedie a cette situation en ajoutant la prise en charge de la haute disponibilite (HA) HDFS: il y a un pair de NameNodes Passif/Actif. En cas de panne du Namenode actif, le passif devient actif pour continuer a repondre aux demandes des clients sans interruption significative."", '- * Le NameNode conserve les metadonnees en memoire pour assurer un acces rapide ce qui necessite une grande taille memoire pour son fonctionnement.\n- * Les blocs de fichiers sont repliques sur plusieurs noeuds (DataNodes).\n- * Le nombre de copies de chaque bloc est contrdle par le parametre de replication (Par defaut 3)\n- * Replication sur plusieurs racks:']","Lorsqu'un NameNode tombe en panne, le processus de récupération consiste à démarrer un nouveau NameNode avec l'une des copies de métadonnées du système de fichiers et à configurer les DataNodes et les applications pour utiliser ce nouveau NameNode. Cependant, avant de répondre aux demandes des clients, le nouveau NameNode doit charger son FSImage dans la mémoire, relire son journal d'édition (EditLog) et recevoir suffisamment de rapports de blocs des DataNodes pour sortir du mode sans erreur (Safe Mode).","The Secondary NameNode in Hadoop contributes to high availability by replicating metadata from the NameNode, preventing loss of metadata and maintaining recent copies. However, it does not provide immediate high availability as clients cannot read, write, or list files if the NameNode fails due to it being the sole reference for metadata and file-block mapping. To recover a failed NameNode, an administrator starts a new NameNode with one of the metadata copies from the filesystem and configures DataNodes and applications to use this new NameNode.",0.8333333333333334,0.6638618398568289,0.9999999999,0.0
How does data visualization contribute to a decision-making system in the context of Business Intelligence?,"['Les outils de BI permettent ensuite de choisir des jeux de données et de créer des interactions et des relations entre eux.', 'La Data Visualisation (""Dataviz"") est l\'une des briques indispensables à la Business Intelligence. Elle permet de visualiser rapidement des informations importantes, afin de les rendre accessibles aux utilisateurs.', ""Une fois que ces données sont sélectionnées par le créateur du rapport, elles sont modélisées sous forme de visuels (tableaux de bords, graphiques, etc.). C'est ce qu'on appelle la Data Visualisation."", ""Il est possible de combiner les données avec un langage de présentation plus intuitif et plus simple, afin de faciliter la compréhension. L'utilisateur peut ainsi directement visualiser les données qui lui sont"", ""2) La consolidation\nLes données prennent forme dans des rapports composés de cartes, de graphiques, de tableaux et de différents visuels. Le système d'information devient décisionnel. La datavisualisation et le datastorytelling interviennent, pour tirer parti des données extraites.""]","La Data Visualization contribue au système de prise de décision en Business Intelligence en permettant une représentation rapide et accessible des informations importantes, facilitant ainsi la compréhension et l'utilisation efficace des données pour prendre des décisions éclairées.","Data visualization is one of the key components of Business Intelligence that contributes to a decision-making system. It enables rapid visual representation of important information, making it accessible to users and facilitating informed decisions.",0.6666666666666666,0.9374767800692734,0.49999999995,0.75
How can we use an ordinateur to learn and improve its task performance?,"[""- • Exemple: un enfant qui apprend à reconnaître des animaux.\n- • Au lieu de programmer explicitement un ordinateur pour qu'il reconnaisse des objets ou effectue des tâches spécifiques, nous fournissons à l'ordinateur des données d'apprentissage.\n- • Ces données sont comme les images d'animaux pour notre enfant.\n- • L'ordinateur extrait des caractéristiques importantes à partir de ces données et ajuste ses paramètres internes pour s'améliorer progressivement dans sa tâche. Plus il voit de données, plus il devient compétent.\n- • Nous pouvons utiliser le machine learning pour analyser des preuves, détecter des schémas et résoudre des enquêtes de manière plus efficace.\n- • Le machine learning repose sur la capacité des ordinateurs à apprendre à partir des données, tout comme nous le faisons en tant qu'êtres humains."", ""Il est possible de combiner les données avec un langage de présentation plus intuitif et plus simple, afin de faciliter la compréhension. L'utilisateur peut ainsi directement visualiser les données qui lui sont"", ""Sous-domaine de l'intelligence artificielle qui permet aux ordinateurs d'apprendre à partir de données sans être explicitement programmés. Cela repose sur la capacité des ordinateurs à apprendre à partir des données, tout comme nous le faisons en tant qu'êtres humains. Le machine learning offre des outils et des techniques puissants pour extraire des informations utiles et des modèles significatifs à partir de données."", ""- • Sous-domaine de l'intelligence artificielle qui permet aux ordinateurs d'apprendre à partir de données sans être explicitement programmés.\n- • Devenu de plus en plus important dans divers domaines, et cela inclut la criminalistique.\n- • À mesure que les volumes de données numériques augmentent, il devient crucial de pouvoir extraire des informations utiles et des modèles significatifs à partir de ces données. Le machine learning offre des outils et des techniques puissants pour accomplir cette tâche."", ""- • Lorsque nous travaillons avec des variables numériques dans nos données, il est souvent nécessaire de normaliser ou de mettre à\n- • L'objectif est de garantir que toutes les variables ont des échelles comparables, ce qui est essentiel pour de nombreux algorithmes d'apprentissage automatique.\n- • Si les variables ont des échelles très différentes, certaines d'entre elles peuvent avoir un impact disproportionné sur le modèle, ce qui peut entraîner des performances médiocres.""]","Nous pouvons utiliser un ordinateur pour améliorer sa tâche par le biais du machine learning. En fournissant des données d'apprentissage, l'ordinateur extrait des caractéristiques importantes et ajuste ses paramètres internes pour s'améliorer progressivement dans sa tâche.","We can use machine learning to teach an ordinateur by providing it with data for learning. Just like a child learns to recognize animals, the ordinateur extracts important features from these data and adjusts its internal parameters to gradually improve its task performance.",1.0,0.8476999065438946,0.7499999999625,0.5
How can business analytics help improve decision-making and risk management with the increasing variety and volume of digital data?,"['- L’utilisation des données numériques : collection, stockage, l’analyse…\n- Objectif : L’amélioration, la prise de décision, la prévision, la gestion des risques\n- Cette utilisation devient plus en plus compliqué avec la variété et le volume de données circulées', ""Elle permet de prendre des décisions et de suivre des tendances, grâce à des outils d'analyse dynamiques.\nElle offre de nouveaux moyens de gérer la performance au quotidien et d'être en mesure de réagir rapidement grâce à des tableaux de bord précis et synthétiques\nDans les entreprises, la Business Intelligence apporte un gain de temps et de fiabilité à ses utilisateurs. La finalité ultime étant\n2 - POURQUOI FAIRE DE LA BUSINESS INTELLIGENCE ? 2-1 - Les avantages de la BI dans les métiers de gestion et de la finance\nUn gain de temps considérable dans la construction et la mise à jour des reportings et des analyses ;\nDes données plus fiables, lorsque les processus de nettoyage et modélisation sont bien en place ; de\nLibérer du temps aux utilisateurs pour la stratégie, l'amélioration continue, et la gestion des risques ;"", ""Les outils de Business Intelligence permettent d'accéder à ces données en temps réel et de les transformer grâce à des applications Web."", ""La Business Analytics est un terme informatique désignant l'utilisation des techniques statistiques, pour analyser et interpréter des données. Elle peut être appliquée au Marketing ou à la Finance par exemple, pour optimiser les processus métiers."", ""- • Sous-domaine de l'intelligence artificielle qui permet aux ordinateurs d'apprendre à partir de données sans être explicitement programmés.\n- • Devenu de plus en plus important dans divers domaines, et cela inclut la criminalistique.\n- • À mesure que les volumes de données numériques augmentent, il devient crucial de pouvoir extraire des informations utiles et des modèles significatifs à partir de ces données. Le machine learning offre des outils et des techniques puissants pour accomplir cette tâche.""]","L'amélioration de la prise de décision et la gestion des risques peuvent être facilitées par la Business Analytics en analysant et interprétant les données numériques, ce qui permet d'extraire des informations utiles et des modèles significatifs, et ainsi libérer du temps aux utilisateurs pour la stratégie, l'amélioration continue, et la gestion des risques.","Business analytics, which involves using statistical techniques to analyze and interpret data, can aid in improving decision-making and risk management by collecting, storing, analyzing digital data. This helps optimize business processes in areas like marketing or finance.",0.5,0.8643353919597004,0.49999999995,0.6666666666666666
How can I improve the performance of my machine learning models by addressing duplicate records in my dataset and ensuring proper data preparation?,"[""- • Consiste à préparer et à organiser les données brutes de manière à ce qu'elles puissent être utilisées efficacement par les modèles d'apprentissage automatique.\n- • La réussite de tout projet d’IA repose en grande partie sur la qualité des données que nous utilisons.\n- • Les données brutes sont souvent désorganisées, incomplètes et peuvent contenir des erreurs.\n- • La préparation des données vise à résoudre ces problèmes en nettoyant, transformant et en préparant les données de manière à ce qu'elles puissent être exploitées par nos modèles.\n- • Une mauvaise préparation des données peut entraîner des résultats médiocres ou biaisés, tandis qu'une préparation rigoureuse peut conduire à des modèles plus performants et plus fiables."", '- • Collecte de Données : la première étape de tout projet de machine learning.\n- • Les données servent de matière première à nos modèles.\n- • Elles peuvent provenir de diverses sources, telles que des bases de données existantes, des capteurs, des enquêtes, des médias sociaux, des vidéos de surveillance, des preuves physiques et bien d\'autres.\n- • Les données doivent être suffisamment représentatives du problème que nous cherchons à résoudre.\n- • Qualité des Données : L\'une des règles d\'or du machine learning est ""Garbage in, garbage out"" (Des données de mauvaise qualité entraînent des résultats de mauvaise qualité).\n- • Préparation des Données : pour qu\'elles soient utilisables par nos modèles.\n- • Cela implique la gestion des valeurs manquantes, la normalisation des données, la conversion de données catégorielles en format numérique, et bien d\'autres.', ""- • Exemple: un enfant qui apprend à reconnaître des animaux.\n- • Au lieu de programmer explicitement un ordinateur pour qu'il reconnaisse des objets ou effectue des tâches spécifiques, nous fournissons à l'ordinateur des données d'apprentissage.\n- • Ces données sont comme les images d'animaux pour notre enfant.\n- • L'ordinateur extrait des caractéristiques importantes à partir de ces données et ajuste ses paramètres internes pour s'améliorer progressivement dans sa tâche. Plus il voit de données, plus il devient compétent.\n- • Nous pouvons utiliser le machine learning pour analyser des preuves, détecter des schémas et résoudre des enquêtes de manière plus efficace.\n- • Le machine learning repose sur la capacité des ordinateurs à apprendre à partir des données, tout comme nous le faisons en tant qu'êtres humains."", ""- • Comprendre l'importance de l’EDA (Exploratory Data Analysis) dans le processus d'analyse de données et de préparation pour l'apprentissage automatique.\n- • Apprendre à faire l'EDA et la préparation des données.\n- • Maîtriser les techniques de visualisation pour révéler des informations essentielles dans les données.\n- • Préparer les données de manière appropriée pour l'entraînement de modèles d'apprentissage automatique."", ""Consiste à préparer et à organiser les données brutes de manière à ce qu'elles puissent être utilisées efficacement par les modèles d'apprentissage automatique. La réussite de tout projet d’IA repose en grande partie sur la qualité des données que nous utilisons.""]","Pour améliorer la performance de vos modèles d'apprentissage automatique, vous devez aborder les enregistrements dupliqués dans votre jeu de données et veiller à une préparation des données appropriée. Voici quelques étapes clés :

1. **Identification des doublons** : Utilisez des techniques d'identification des doublons, telles que l'utilisation de hachages de SHA-256 ou de l'algorithme de Jaro-Winkler, pour identifier les enregistrements similaires ou identiques.
2. **Suppression des doublons** : Supprimez les enregistrements dupliqués ou supprimerez les champs redondants pour éviter toute duplication.
3. **Nettoyage des données** : Nettoyez vos données en supprimant les valeurs manquantes, les données erronées et les données incomplètes.
4. **Normalisation des données** : Normalisez vos données en appliquant des transformations, telles que la normalisation standard, la normalisation logarithmique ou la normalisation logistique, pour garantir que toutes les variables ont la même échelle.
5. **Conversion de données catégorielles** : Convertissez les données catégorielles en format numérique, tel que l'énumération ou l'encodage one-hot, pour permettre aux algorithmes d'apprentissage automatique de les traiter correctement.
6. **Analyse exploratoire des données** : Effectuez une analyse exploratoire des données pour comprendre leur structure, leurs tendances et leurs corrélations, et ajustez votre stratégie de préparation des données en conséquence.
7. **Préparation des données pour l'entraînement** : Préparez vos données de manière appropriée pour l'entraînement de modèles d'apprentissage automatique, en tenant compte des exigences spécifiques de chaque algorithme.

En suivant ces étapes, vous pouvez améliorer considérablement la qualité de vos données et augmenter la performance de vos modèles d'apprentissage automatique.","To improve the performance of your machine learning models, you should first identify and manage duplicate records in your dataset. Duplicate records can cause biases in your models and lead to inaccurate results. Next, ensure proper data preparation by cleaning, transforming, and organizing your data so that it can be effectively used by your models. This will help create more reliable and robust models.",0.5,0.7239034812759731,0.0,0.25
What is Angular?,"[""▪Dans Angular, un composant est l'une des briques de base les plus fondamentales.\n▪L’application est formée par un ensemble de composants.\n▪Chaque composant peut imbriquer d’autres composants définissant ainsi une structure hiérarchique.\n▪Il s'agit d'une classe décorée avec @Component, qui encapsule les données et la logique nécessaires pour afficher une partie de l'interface utilisateur (UI).\n▪Chaque composant est responsable d'une section spécifique de l'écran et peut interagir avec d'autres composants et services pour fonctionner dans l'ensemble de l'application."", '- ""a collection of data from traditional and digital sources inside and outside a company that represent a source of ongoing discovery and analysis.""\n- * Quelques exemples d\'utilisation de la Big Data\n- * Commercial\n- * Science\n- « Web / event / database logs\n- e Astronomy\n- * Sensor networks\n- « Atmospheric science\n- * Internet text and documents\n- * Genomics\n- * Medical records\n- * Biogeochemical\n- « Photographic archives\n- * Biological\n- * Video / audio archives\n- * Social\n- ¢ Social networks\n- * Government\n- « Military and homeland security surveillance\n- * Social data\n- * Twitter\n- * Facebook', 'La matière première sur laquelle les modèles de machine learning sont formés. Par exemple, des informations sur les crimes, les suspects, les lieux, etc. pour une application en criminalistique.', ""Un ensemble de technologies, d'architecture, d'outils et de procédures permettant à une organisation de collecter, traiter et analyser de larges quantités et contenus hétérogènes et changeants, et d'en extraire les informations pertinentes à un coût accessible."", ""Le Big Data est un ensemble d'informations et de données très diverses. Il intègre des données""]",La réponse n'est pas disponible car le texte ne mentionne pas ce que vous demandez.,"Angular is a JavaScript framework presented by Google in 2009, used for creating web and mobile applications.",0.0,0.28307413198579684,0.0,0.0
"How does the Distributed File System manage metadata and ensure data availability across multiple nodes, specifically regarding replication on different racks?","['- * Le NameNode conserve les metadonnees en memoire pour assurer un acces rapide ce qui necessite une grande taille memoire pour son fonctionnement.\n- * Les blocs de fichiers sont repliques sur plusieurs noeuds (DataNodes).\n- * Le nombre de copies de chaque bloc est contrdle par le parametre de replication (Par defaut 3)\n- * Replication sur plusieurs racks:', ""- . Le client appelle la methode create(Q) de l'objet DistributedFileSystem qui permet de de créer un nouveau fichier pour écriture.\n- . Cet objet se connecte au NameNode a l'aide de RPC et lui demande la creation d'un nouveau fichier. A ce stade on n’associe aucun bloc a ce fichier. Le NameNode verifie s'il y a deja un autre fichier de meme nom et si le client a les droits nécessaires pour créer le fichier. Dans ce cas, une entree (dans le FsImage) est créee pour le nouveau fichier. Dans le cas contraire, une exception IOException est soulevee.\n- . Un objet de la classe FSDataOutputStream est retourne au client afin de l'utiliser pour ecrire le contenu du fichier dans HDFS en invoquant la methode write() (en boucle)\n- . L'objet FSDataOutputStream utilise un autre objet DFSOutputStream qui gere la communication avec les DataNodes et le NameNode. DFSOutputStream cree a fur et a mesure des paquets (64k) avec les donnees écrites par le client. Ces paquets sont mis dans une file d'attente appelee DataQueue. DFSOutputStream decompose ainsi les fichiers a écrire en paquets."", 'Le NameNode conserve les métadonnées en mémoire pour assurer un accès rapide, les blocs de fichiers sont répliqués sur plusieurs nœuds (DataNodes).', ""- * Secondary NameNode (suite)\n- *La replication des metadonnees du NameNode et utilisation du NameNode secondaire permet d'eviter la perte de metadonneées et de conserver des copies recentes.\n- * Mais elle n'offre pas une haute disponibilite du systeme de fichiers: oEn cas d'echec du NameNode, tous les clients, y compris les jobs MapReduce, ne pourraient pas lire, ecrire ou repertorier les fichiers, car le NameNode est le seul referentiel des metadonnees et du mapping fichier-bloc.\n- oDans un tel cas, l'ensemble du systeme Hadoop serait hors service jusqu'a ce qu'un nouveau NameNode puisse etre mis en ligne.\n- *Pour recuperer un NameNode defaillant, l'administrateur demarre un nouveau NameNode avec l'une des copies de metadonnees du systeme de fichiers et configure les DataNodes et les applications pour utiliser ce nouveau NameNode."", '- ""Le NameNode est un point de deéfaillance unique (Single Point of Failure - SPOF): Si la machine executant le NameNode est perdue, toutes les informations (meta-data) sur les fichiers de données seraient perdues. Par conséquent, on ne pourra pas reconstruire les fichiers a partir des blocs sur les DataNodes.\n- ""Hadoop sauvegarde les métadonnees du systeme de fichiers (Fsilmage): NameNode écrit son etat persistant sur plusieurs systemes de fichiers (disque local, disque distant).\n- * Utiliser un NameNode secondaire: n\'a pas le meme role que le NameNode. Il fusionne periodiquement I\'image de l\'espaces des noms (Fslmage) et le journal d\'édition (EditLog) pour eviter que ce dernier devienne trop volumineux. Il s\'execute sur une machine physique distincte (nécessite beaucoup de CPU et de RAM pour effectuer la fusion']","La Distributed File System gère les métadonnées et assure la disponibilité des données à travers plusieurs nœuds en utilisant la réplication sur différents racks. La réplication des blocs de fichiers est contrôlée par le paramètre de réplication (par défaut 3). Cela signifie que chaque bloc est répliqué trois fois, ce qui garantit que les données restent disponibles même en cas de panne d'un nœud.","The Distributed File System manages metadata by having the NameNode store it in memory for quick access, although this requires significant memory. To ensure data availability, the system replicates file blocks across several DataNodes. The number of copies per block is controlled by a replication parameter (default is 3), and replication occurs on different racks to enhance fault tolerance.",1.0,0.8008956518796507,0.9999999999,0.6666666666666666
Can you explain the role of a Model in the MVVM architecture and how it interacts with the View?,"['Respecte l’architecture MVVM (Model-View-ViewModel)\nModel : représenté généralement par une classe référencée par la couche d’accès aux données (classe ou interface TypeScript).\nView: contenant la disposition et l’apparence de ce qu’un utilisateur voit à l’ écran, recevant l’interaction avec l’utilisateur : clic, saisie, survol...\nViewModel: remplaçant du contrôleur dans l’architecture MVC, connecté à la vue par le data binding, représenté dans Angular par un fichier *.component.ts.', ""Il est possible de combiner les données avec un langage de présentation plus intuitif et plus simple, afin de faciliter la compréhension. L'utilisateur peut ainsi directement visualiser les données qui lui sont"", ""- • Utilisée pour comprendre les relations entre les variables.\n- • Étape cruciale dans l'analyse de données.\n- • La détection de corrélations ou de dépendances entre les variables.\n- • La capacité à identifier des tendances et des modèles complexes.\n- • L'aide à la prise de décision informée en identifiant les facteurs qui influencent les résultats.\n- • Outils de visualisation à utiliser :\n- • des graphiques de dispersion (scatter plots) pour les relations bivariées\n- • des heatmaps ainsi que des pairplots pour les relations multivariées."", ""- • Explorer la distribution des variables individuelles dans un ensemble de données en utilisant des visualisations univariées.\n- • Cela permettra d'identifier les caractéristiques clés et les anomalies dans les données.\n- • La personnalisation des graphiques est importante pour les rendre compréhensibles et informatifs.\n- • Il faut choisir les visualisations appropriées en fonction du type de variable (continue ou catégorique) et des objectifs de leur analyse.\n- • On peut créer des histogrammes pour visualiser la distribution des variables"", ""- • Consiste à préparer et à organiser les données brutes de manière à ce qu'elles puissent être utilisées efficacement par les modèles d'apprentissage automatique.\n- • La réussite de tout projet d’IA repose en grande partie sur la qualité des données que nous utilisons.\n- • Les données brutes sont souvent désorganisées, incomplètes et peuvent contenir des erreurs.\n- • La préparation des données vise à résoudre ces problèmes en nettoyant, transformant et en préparant les données de manière à ce qu'elles puissent être exploitées par nos modèles.\n- • Une mauvaise préparation des données peut entraîner des résultats médiocres ou biaisés, tandis qu'une préparation rigoureuse peut conduire à des modèles plus performants et plus fiables.""]","Dans l'architecture MVVM, le rôle du modèle est de représenter les données et de fournir un accès sécurisé et géré aux données. Il est généralement représenté par une classe référencée par la couche d'accès aux données. Le modèle n'interagit pas directement avec la vue, mais il fournit les données nécessaires au ViewModel, qui ensuite les transmet à la vue via le data binding.","In the MVVM (Model-View-ViewModel) architecture, the Model represents the data and its business logic. It is typically represented by a class referenced by the data access layer. The View contains the layout and appearance of what a user sees on the screen, receiving interactions with the user such as clicks or keyboard inputs. The ViewModel replaces the controller in the MVC architecture, connecting to the View through data binding, and is represented in Angular by a *.component.ts file. In this context, the Model interacts with the View indirectly through the ViewModel.",0.5,0.8827237092862378,0.9999999999,1.0
"How does the concept of 'Big Data' address the challenges posed by voluminous data with variety and velocity, as demonstrated during its inception in 2012?","[""- La notion de Big Data est un concept s'étant popularisé en 2012 pour traduire le fait que les entreprises sont confrontées à des volumes de données à traiter de plus en plus considérables et présentant un fort enjeux commercial et marketing\n- Ces Grosses Données en deviennent difficiles à travailler avec des outils classiques de gestion de base de données\n- Il s’agit donc d’un ensemble de technologies, d’architecture, d’outils et de procédures permettant à une organisation de très rapidement collecter, traiter et analyser de larges quantités et contenus hétérogènes et changeants et d’en extraire les informations pertinentes à un coût accessible."", ""Le Big Data est un ensemble d'informations et de données très diverses. Il intègre des données"", '- Le Big Data (BD), littéralement « grosses données », ou méga données, parfois également appelés données massives. Il désigne un ensemble très volumineux de données qu’aucun outil classique de gestion de base de données ou de gestion de l’information ne peut vraiment travailler. Inventé par les géants du web, Le BD se présente comme une solution dessinée pour permettre à tout le monde d’accéder en temps réel à des bases de données géantes.', ""- «ll n'y a pas de definition unique du Big Data, mais certains elements sont communs a toutes les définitions: la velocite, le volume, la variéte.\n- * Extraire, de maniere rapide et rentable, des connaissances a partir de donnees volumineuses , variées et d'une vitesse élevéee.\n[TABLE]\nVolume: varie de terabytes a4 zettabytes. On doit traiter i“ ~ efficacement ce volume croissant. Variete: Gérer divers types et structures de données Velocite: Analyser les flux de données en continu et les grands volumes de données persistantes. a) Veracite: authenticité et fiabilité des données necessitant une grande rigueur dans la _ collecte, le recoupement, le croisement et l'enrichissement des données pour lever l'incertitude pour garantir 'integrite des données.\nValeur: le point le plus important, une solution Big Data doit apporter une valeur ajoutee pour l'entreprise en repondant a des objectifs commerciaux ou Marketing qui orientent l'utilisation des Big Data."", ""Un ensemble de technologies, d'architecture, d'outils et de procédures permettant à une organisation de collecter, traiter et analyser de larges quantités et contenus hétérogènes et changeants, et d'en extraire les informations pertinentes à un coût accessible.""]","La notion de Big Data répond aux défis posés par les données volumineuses, variées et rapides en utilisant des technologies, architectures, outils et procédures pour collecter, traiter et analyser de grandes quantités de données hétérogènes et changeantes, tout en extrayant les informations pertinentes à un coût accessible.","The concept of 'Big Data', popularized in 2012, addresses the challenges posed by voluminous data with variety and velocity by providing an ensemble of technologies, architectures, tools, and procedures that enable organizations to rapidly collect, treat, and analyze large quantities of varied and changing contents, extracting pertinent information at an accessible cost.",1.0,0.6759744368233941,0.6999999999766667,0.75
How can we make 'decision making' in real-time with BI tools?,"[""Il est possible de combiner les données avec un langage de présentation plus intuitif et plus simple, afin de faciliter la compréhension. L'utilisateur peut ainsi directement visualiser les données qui lui sont"", ""Les outils de Business Intelligence permettent d'accéder à ces données en temps réel et de les transformer grâce à des applications Web."", 'Les outils de BI permettent ensuite de choisir des jeux de données et de créer des interactions et des relations entre eux.', ""La Business Intelligence est une solution informatique qui permet aux utilisateurs de visualiser et d'analyser des données en temps réel (données de gestion, de finance, d'activité commerciale, de marketing, etc.)."", ""La Business Intelligence s'appuie sur le processus ETL (Extract Transform Load) pour offrir à l'utilisateur la donnée la plus pertinente.""]","Nous pouvons faire du décisionnel en temps réel avec les outils BI en combinant les données avec un langage de présentation plus intuitif et plus simple, puis en accédant à ces données en temps réel et en les transformant grâce à des applications Web, et enfin en choisissant des jeux de données et en créant des interactions et des relations entre eux.","Business Intelligence tools allow access to data in real-time and transform it through web applications, enabling real-time decision-making.",0.75,0.9400738633883039,0.499999999975,0.6666666666666666
What operations can't be done on columns with wrong data types and why might we need to convert them?,"[""La conversion des types de données peut être nécessaire pour économiser de la mémoire, pour permettre des opérations spécifiques, et pour faciliter l'analyse."", ""- • Il peut être nécessaire de convertir les types de données dans un ensemble de données.\n- • Les types de données déterminent les opérations que vous pouvez effectuer sur les colonnes.\n- • Parfois, on doit changer les types de données pour réaliser certaines opérations.\n- • La conversion peut être nécessaire pour traiter correctement les données, notamment lorsque des colonnes numériques doivent être interprétées comme des colonnes catégoriques.\n- • Il faut être attentifs aux types de données lors de l'importation initiale des données et à comprendre les besoins de leur analyse pour décider des conversions nécessaires."", 'La conversion des types de données peut être nécessaire pour traiter correctement les données, notamment lorsque des colonnes numériques doivent être interprétées comme des colonnes catégoriques.', ""- • Pour économiser de la mémoire : La conversion en types de données plus spécifiques peut réduire l'utilisation de la mémoire.\n- • Pour permettre des opérations spécifiques : Parfois, des opérations ne sont possibles qu'avec certains types de données.\n- • Pour faciliter l'analyse : Convertir des données en types plus appropriés peut rendre l'analyse plus efficace et précise."", '- • Les types de données déterminent les opérations que vous pouvez effectuer sur ces colonnes.\n- • Les opérations mathématiques telles que la somme, la moyenne, et la multiplication ne sont possibles que sur les colonnes numériques (int et\n- • Les colonnes de type string sont principalement destinées aux opérations de traitement du texte.\n- • Les colonnes datetime permettent des opérations de filtrage temporel, de regroupement par période, etc.']","Les opérations qui ne peuvent pas être faites sur les colonnes avec des types de données incorrects sont les opérations mathématiques telles que la somme, la moyenne, et la multiplication, car elles nécessitent des colonnes numériques (int et float).","Columns with incorrect data types may not allow certain operations. For instance, numeric columns interpreted as categorical ones might cause issues. We might need to convert data types to perform specific operations or treat data correctly.",1.0,0.8589157755035449,0.5333333333155555,1.0
What are the main components of an Angular application and how do they relate to each other?,"[""Une application Angular se compose de :\n▪Un à plusieurs modules dont un est principal.\n▪Chaque module peut inclure :\n➢Des composants web : La partie visible de l'application Web (IHM)\n➢Des services pour la logique applicative. Les composants peuvent utiliser les services via le principe de l’injection des dépendances.\n➢Des directives : un composant peut utiliser des directives\n➢Des pipes : utilisés pour formater l’affichage des données dans les composants."", ""- • Facilité d'interprétation : Les barres représentent clairement les catégories et leurs fréquences, ce qui facilite l'interprétation des données.\n- • Comparaisons visuelles : de la fréquence ou la distribution des catégories, utile pour les analyses comparatives.\n- • Personnalisation : pour rendre les graphiques informatifs et esthétiques.\n- • Adaptabilité : fonctionnent pour des variables catégoriques avec un petit nombre de catégories, mais aussi pour des variables avec un nombre plus élevé de catégories.\n- • Prise de décision : Utilisés pour prendre des décisions basées sur des données discrètes."", ""▪Dans Angular, un composant est l'une des briques de base les plus fondamentales.\n▪L’application est formée par un ensemble de composants.\n▪Chaque composant peut imbriquer d’autres composants définissant ainsi une structure hiérarchique.\n▪Il s'agit d'une classe décorée avec @Component, qui encapsule les données et la logique nécessaires pour afficher une partie de l'interface utilisateur (UI).\n▪Chaque composant est responsable d'une section spécifique de l'écran et peut interagir avec d'autres composants et services pour fonctionner dans l'ensemble de l'application."", '➢Une SPA contient une seule page HTML (index.html),\n➢Pour naviguer entre les différentes parties de l’application, JS est utilisé pour envoyer des requêtes http (AJAX) vers le serveur pour récupérer du contenu dynamique au format JSON,\n➢Ce contenu JSON sera affiché coté client, dans la même page, en utilisant HTML et CSS', ""- • Consiste à préparer et à organiser les données brutes de manière à ce qu'elles puissent être utilisées efficacement par les modèles d'apprentissage automatique.\n- • La réussite de tout projet d’IA repose en grande partie sur la qualité des données que nous utilisons.\n- • Les données brutes sont souvent désorganisées, incomplètes et peuvent contenir des erreurs.\n- • La préparation des données vise à résoudre ces problèmes en nettoyant, transformant et en préparant les données de manière à ce qu'elles puissent être exploitées par nos modèles.\n- • Une mauvaise préparation des données peut entraîner des résultats médiocres ou biaisés, tandis qu'une préparation rigoureuse peut conduire à des modèles plus performants et plus fiables.""]","Les principaux composants d'une application Angular sont :

* Un ou plusieurs modules, dont un est principal.
* Chaque module peut inclure :
  + Des composants web : La partie visible de l'application Web (IHM)
  + Des services pour la logique applicative. Les composants peuvent utiliser les services via le principe de l'injection des dépendances.
  + Des directives : un composant peut utiliser des directives
  + Des pipes : utilisés pour formater l'affichage des données dans les composants.

Les composants sont les briques de base les plus fondamentales d'une application Angular. Ils sont responsables d'une section spécifique de l'écran et peuvent interagir avec d'autres composants et services pour fonctionner dans l'ensemble de l'application.

La structure hiérarchique des composants permet d'imbriquer d'autres composants, créant ainsi une structure complexe et organisée.

Notez que les autres parties du texte ne fournissent pas d'informations supplémentaires sur les composants, mais parlent plutôt de graphiques, de données, de Single Page Application (SPA) et de préparation des données pour l'apprentissage automatique.","An Angular application is composed of one or more modules, with one being primary. Each module can include web components (visible parts of the application), services for logic, directives used by components, and pipes for data formatting in components.",1.0,0.9858681686702649,0.9999999999,0.5
What is the mode used for in data imputation?,"[""Le processus ETL (Extract Transform Load) permet d'agréger un grand volume de données et de les transformer, afin d'en extraire des informations pertinentes pour l'utilisateur."", ""La Business Intelligence s'appuie sur le processus ETL (Extract Transform Load) pour offrir à l'utilisateur la donnée la plus pertinente."", ""Un ensemble de technologies, d'architecture, d'outils et de procédures permettant à une organisation de collecter, traiter et analyser de larges quantités et contenus hétérogènes et changeants, et d'en extraire les informations pertinentes à un coût accessible."", ""Les outils de Business Intelligence permettent d'accéder à ces données en temps réel et de les transformer grâce à des applications Web."", ""Le Data storytelling est une technique qui consiste à raconter des histoires sur l'entreprise, ses produits, sa technologie et son marché. Elle permet de capter l'attention des utilisateurs en montrant les données et l'organisation d'un produit ou d'un service.""]",La méthode utilisée pour l'imputation de données n'est pas mentionnée dans le texte fourni.,"The mode, which is the value that appears most frequently in a dataset, can be used for data imputation to replace missing values with the most common value in that column.",1.0,0.0,0.0,0.5
